{
  "$schema": "https://json-schema.org/draft/2020-12/schema",
  "$id": "gamecult.eve.plugin_advertisement.v1",
  "title": "Eve Plugin Advertisement",
  "type": "object",
  "required": [
    "schema",
    "pluginId",
    "ownerService",
    "version",
    "manifestAddress",
    "schemas",
    "componentKinds",
    "commands",
    "fixtures"
  ],
  "properties": {
    "schema": {
      "const": "gamecult.eve.plugin_advertisement.v1"
    },
    "pluginId": {
      "type": "string",
      "minLength": 1
    },
    "ownerService": {
      "type": "string",
      "minLength": 1
    },
    "version": {
      "type": "string",
      "minLength": 1
    },
    "manifestAddress": {
      "type": "string",
      "minLength": 1
    },
    "schemas": {
      "type": "array",
      "items": {
        "type": "string",
        "minLength": 1
      }
    },
    "componentKinds": {
      "type": "array",
      "items": {
        "type": "string",
        "minLength": 1
      }
    },
    "commands": {
      "type": "array",
      "items": {
        "type": "string",
        "minLength": 1
      }
    },
    "fixtures": {
      "type": "array",
      "items": {
        "type": "string",
        "minLength": 1
      }
    }
  },
  "additionalProperties": true
}
